Person,Conversation,Custom Tag,Custom Tag 2,Topic Description
A,Okay.,,,
B,Okay.,,,
A,So tell me about CHINA CRY.,,,
B,"Okay,",,,
B,"CHINA CRY was basically the, the true story written by this, this lady who had, uh, was a native, a native Chinese, uh, uh, who was raised by Christian parents.",,,
A,Uh-huh.,,,
B,"And her, her time frame was prior to the nineteen forty-nine revolution.",,,
A,I see.,,,
B,"Although she, herself, had never really accepted Jesus or gone through any of the other, uh, Christian, uh, portions of, of the faith, repentance, baptisms, et cetera, et cetera. She had always felt a very strong, uh, leaning in this direction.",,,
B,"And whenever the cultural revolution of nineteen forty-nine occurred and most churches were either banned or their, all the clergy and so forth were killed or, or imprisoned or, and the property confiscated, she was safe because she had, you know, not officially joined the, the Christian movement.",,,
A,Uh-huh.,,,
B,"So anyway, she, as she grew up towards maturity, her parents, well,",,,
B,her dad was a doctor,,,
B,"and, and he was rather well, you know, rather well to do in the old regime",,,
B,"and the, the the the communist Chinese didn't like this at all.",,,
B,"You know, the bourgeoisie was, was, was definitely out of, uh, style, then.",,,
A,Right.,,,
B,Everybody was back to a commonality of one.,,,
B,"And so they kept picking at him, picking at his, at her mother and, uh, finally, uh, started picking on her. And getting her to, you know,",,,
A,Uh-huh.,,,
B,"they were starting to, uh, accuse her of, of, of, uh, crimes and atrocities before the, the revolution and, and had her write her own story over and over and over.",,,
B,"Uh, and the, uh, the major point of the movie was that, that she had, uh, married this, this Chinese fellow and was with child when they started this mass court.",,,
B,"Now, I think I'm leaving out a portion.",,,
B,"She she went through college and graduated very high up in her class and had, uh, gotten a job as, as an instructor",,,
B,"and they had her teaching, or were starting to have her teach history for the soldiers. When the, they decided that, that she needed to start recanting of all of her pre, uh, regime crimes as it were.",,,
A,Uh-huh.,,,
A,Uh-huh.,,,
B,"Being a child, you know.",,,
B,"So, they kept on and on at, at her,",,,
B,"and in the meantime, she and her husband, uh, were were expecting a child, their own child.",,,
B,"And, uh, the, the people kept harassing her over, you know, over a period of months",,,
B,"and finally they, uh, carried her, uh, out into the courtyard to, to, either really to shoot her or to go through the motions of, of shooting her, uh, with by firing, or, you know, executing her by firing squad.",,,
A,Uh-huh.,,,
B,"And, uh, the Lord just said no,",,,
B,"this is not going to happen even though this lady has not really, you know,",,,
B,"she's, she's one of mine,",,,
B,she is not going to die,,,
B,"and, uh, the, the soldiers were blinded when they shot.",,,
A,Huh.,,,
B,"And she, her life was spared.",,,
B,"And this, this frightened the, the, uh, the commandant",,,
B,and so he called this kind of stuff off and just put her in the labor camp.,,,
A,Huh.,,,
B,"Well, uh, and, course, here's this, this woman who is heavy with child dragging rocks around.",,,
A,Huh.,,,
B,"Well she, she put in for going, going to, uh,",,,
B,"and her husband had escaped to Hong Kong, uh,",,,
B,and then she put in to go see him.,,,
B,"And over time she, uh, uh,",,,
B,"finally, through her perseverance and writing enough letters to enough different people embarrassed enough of the, the middle, uh, bureaucracy that they finally let her go.",,,
A,Huh.,,,
B,"And, of course, she had to walk.",,,
B,"You know, they, they stripped her of everything, practically besides the, the clothes on her back.",,,
B,"And, uh, so she, so she went across the border to her husband and another, and other child that they'd already had uh, to freedom.",,,
A,Uh-huh.,,,
A,Oh.,,,
B,"And they knew that she wasn't going to come back,",,,
B,"but yeah, she did, years later when the, uh, liberalization, you know, in real life liberalization of China happened,",,,
A,Uh-huh.,,,
B,"and, uh, she was not persecuted or anything else like that.",,,
A,Huh. Interesting story.,,,
B,"Yes,",,,
B,it was.,,,
B,"Uh, very moving, too.",,,
A,"I, uh, I don't even remember seeing that advertised",,,
A,and it was probably here and gone fairly quickly.,,,
B,"Well, it was within, oh, ninety days.",,,
A,Oh. That recent.,,,
B,Yeah.,,,
B,"No,",,,
B,"I mean it's, it was, it was advertised over a period of about ninety days.",,,
A,"Oh, I see what you mean.",,,
B,"But it wasn't,",,,
B,"uh, they didn't have it in, uh, too awfully many movie houses,",,,
B,"but it was, it was, in the,",,,
B,"it had large, uh, uh, uh, press release.",,,
A,Uh-huh.,,,
A,"Well, uh, I guess what I, what I saw most recently and luckily I saw it only a week ago so I'd remember remember it well was, uh, sort of light by comparison.",,,
B,Okay.,,,
B,Uh-huh.,,,
A,"Uh, my husband and I had this great desire to go see a comedy",,,
A,"and, and, uh, we ended up going to see GREEN CARD.",,,
B,GREEN CARD?,,,
A,GREEN CARD.,,,
B,Uh-huh.,,,
A,"And, uh, he chose it",,,
A,"and, uh, it's got this wonderful French actor who's,",,,
A,"it was his, like, his,",,,
A,"and he's been a star in France and a wonderful actor who we've enjoyed for years,",,,
A,but he's never made an American film.,,,
A,This was his American film debut,,,
B,"Oh, I see,",,,
B,uh-huh.,,,
A,and he speaks very broken English.,,,
A,"And basically he played, uh, a Frenchman who married an American girl, uh, in a marriage of convenience so that he could get his green card, which is what an alien needs to work in this country.",,,
B,Uh-huh.,,,
B,"Right,",,,
B,uh-huh.,,,
A,"And, uh, because she could claim she was married, she could get, uh, an apartment or a condominium in a very exclusive building in New York that had a garden, an, an, an outside garden, which is very unusual there.",,,
B,Uh-huh.,,,
A,"So she was a horticulturist,",,,
A,and that was sort of her dream.,,,
B,"Oh, I see,",,,
B,uh-huh.,,,
A,"Of course, you know, they got married",,,
A,and they never saw each other again.,,,
A,"Except, except fate through them together *through threw",,,
A,"and the Immigration and Naturalization Service, uh, started investigating.",,,
A,"So they had to get back together and get their stories straight,",,,
A,"and, and she was a very svelte, sophisticated urban New Yorker",,,
B,Oh.,,,
A,"and he was a, a poor Frenchman who had grown up on the, on the streets and sort of pulled himself up by his bootstraps and claimed to be a composer,",,,
A,but there was no proof whatsoever that he really was.,,,
B,Uh-huh.,,,
A,He'd been working in a restaurant when they met.,,,
B,Uh-huh.,,,
A,"And, uh, they had to learn all about each other basically in a, in a weekend.",,,
B,Just then.,,,
A,"And, uh, it was,",,,
A,"you knew what was going to happen, of course. That they would fall in love.",,,
B,Uh-huh.,,,
A,"Well, they fell into like, at any rate",,,
A,"and and when they went to the query or inquisition or whatever, uh, they did perfectly",,,
B,"Right,",,,
B,uh-huh.,,,
A,"and then he said something, because his English was so poor on, for the most part,",,,
A,"he, he was so proud of himself for giving all the correct answers that, that on the last one he said, oh, I never remember that answer",,,
A,and that clued the investigator that he had memorized a series of answers.,,,
B,Uh-huh.,,,
B,Uh-huh.,,,
A,"So, uh,",,,
