Person,Conversation,Custom Tag,Custom Tag 2,Topic Description
B,You ready?,,,
A,Yeah.,,,
B,Okay.,,,
B,What have you seen lately?,,,
A,"Well, uh, it's funny, when I tried, to make the call the other days,",,,
A,"I thought,",,,
A,I hadn't seen anything since DANCES WITH WOLVES,,,
A,but today I went to see REGARDING WITH HENRY.,,,
B,"Oh, I'm dying to see  that.",,,
A,It  was really good.,,,
A,We,,,
B,Oh.,,,
A,"uh, Jeff Wariner just got out of the hospital",,,
B,Uh-huh,,,
A,"and, uh, Jeff and Deeanna went and another friend in the neighborhood,",,,
A,"and, uh, we all liked it.",,,
A,"We had both moms and, uh, fifteen year olds and a twelve year old",,,
A,and everyone enjoyed it.,,,
B,"Oh, my goodness.",,,
A,"And, uh,",,,
B,"Oh, well  I am just dying to see it.",,,
B,I went to dinner with some friends last weekend,,,
B,and they said get a baby-sitter,,,
B,and we'll all go see REGARDING HENRY,,,
A,Yeah.,,,
B,"and I said, ooh, I want to see it so bad.",,,
A,"Well, my son had gotten to see a lot of movies this summer, on, choir tour and visiting friends and one thing and another. A lot of the ones I had wanted to see",,,
B,Oh.,,,
A,"and so since he had this friend up from Houston, uh, and his friend had already seen so many and I thought they decided on this and I thought well, I want to see this one, too.",,,
A,"So,  we, uh,  I",,,
B,Yeah.,,,
A,"finally, it's my first summer movie",,,
B,Oh my.,,,
B,"Well, let me see.",,,
B,"Was it,",,,
B,"well, we went to see ONE HUNDRED AND ONE DALMATIANS last weekend",,,
B,"and that may be,",,,
B,"no,",,,
B,"right before I went in the hospital my girlfriend said come on,",,,
B,we're going to the movies.,,,
B,"And we won't,",,,
B,well she goes all the time,,,
B,but I go maybe once every couple of months.,,,
A,Yeah.,,,
B,"And when I go, I go see two at a time.",,,
B,"So we went to see SOAPDISH,",,,
B,and,,,
A,"Oh,  was that good?",,,
A,"Cause,",,,
B,"Oh, hysterical.",,,
B,"We laughed so hard,",,,
B,"it was just, you couldn't hear half the dialogue because everyone in the audience was  laughing   so hard.",,,
A,Yeah.,,,
A,"Well, I want  to see that and CITY SLICKERS both.",,,
A,I love   comedies.,,,
B,Yeah,,,
A,"But, that's what I was",,,
B,that's the other one that we went to that night.,,,
A,"Oh, was it?",,,
B,"And, my face hurt so bad, from laughing because I love Billy Crystal.",,,
A,Oh,,,
B,"And course, growing up on, on the back of a horse, you know, and being on ranches and stuff, so much of that was so true",,,
B,and I was absolutely rolling in the aisles.,,,
B,It was so funny.,,,
B,Both of them were great.,,,
A,"Oh, well good.",,,
A,"I'm, I'm glad to hear that  because they,",,,
B,"Oh, they are,  are",,,
B,we just laughed so hard.,,,
B,"And like I said, with CITY I mean with SOAPDISH, it is so cornball",,,
B,and it is so overacted that you're just hysterical you know.,,,
A,Uh-huh,,,
B,"Just, they just carried it off, to the tee.",,,
A,"Well, I don't, I don't know if you got to see WEEKEND, um, AT BERNIE'S  that  was out a couple of years ago.",,,
B,No.,,,
A,"They had a free showing at the Berkeley, um, United Artist.",,,
B,How neat.,,,
A,"And, I don't know who was here or whether Jay called a friend",,,
A,and we didn't think we'd have much chance of getting in,,,
A,"but we thought we'd try it, you know, free movie.",,,
B,"Shoot,",,,
B,yeah.,,,
A,"It was so funny and it sounds like, uh, what you were just describing, SOAPDISH, too.",,,
A,"I mean, we just, we hurt by the time we came  out.",,,
B,Oh  yeah.,,,
A,And the whole theater was hysterical,,,
A,"and it's just, it's just goofy.",,,
A,"I mean, it's, uh,",,,
A,"if you have a chance to rent it, at least,",,,
A,"or it should be  out on T V, I would think,",,,
B,"Yeah,",,,
B,I think it is.,,,
B,I think it is.,,,
A,"Um, cause it's, it's just a fun summer light comedy,",,,
A,make your cheeks hurt laughing.,,,
A,"Especially in the theater it was contagious, you know",,,
B,Yeah.,,,
A,"I, I imagine the way SOAPDISH was, but,  with   everyone laughing.",,,
B,Oh gosh,,,
B,I never laughed.,,,
B,And people were just screaming and applauding,,,
B,"and, you know, it was just hysterical.",,,
A,"Well, I'm glad you did that before your surgery",,,
B,"Oh, me too, because I don't even know if I could live through it now.",,,
A,Yeah,,,
B,I mean I'm getting around real good,,,
B,and I'm just still real sore.,,,
A,Yeah.,,,
B,"And today I was, I, course I went back to work two weeks after,  uh",,,
A,"Oh,  gosh.",,,
B,but see I don't have permanent work.,,,
B,"I, right now I'm working with a temporary agency.",,,
B,"And so, the second week I was out of the hospital I went up and worked half day on the computers cause you can learn all the software for free.",,,
A,Oh.,,,
B,"Oh, so I went up to do WordPerfect cause that seems like that's what everybody wants,",,,
B,and I was up there half a day and came home and collapsed.,,,
A,Yeah.,,,
B,And then they called me to see if I wanted to work a day.,,,
B,"And I said, yeah,",,,
B,and I went,,,
B,and of course it took me the whole weekend to recover from that.,,,
B,"And, uh, I worked about three days a week ever since, two to three days a week.",,,
B,"And so I went to my doctors last Thursday,",,,
B,and this was my fourth week checkup,,,
B,"and he said well gosh, you're just healing really well,",,,
B,I just can't get over this.,,,
B,"He says, in two weeks you can go back to doing your crazy normal things.",,,
B,"If you want to play ball, you can go play ball.",,,
B,"He says, now I'm not going to say you're going to feel like playing ball",,,
B,but you can if you want to.,,,
A,Yeah,,,
B,"And, uh, you know, he was teasing me",,,
B,"and he says, yeah,",,,
B,"you'll be out there waterskiing,",,,
B,I can just see it  now.,,,
B,"And, uh, he says so you just take it easy for two more weeks.",,,
B,You've only got two more weeks.,,,
B,"I said okay fine, I, I will, I will",,,
B,"Whatever you call easy, I'll do it, you know.",,,
B,But and I've been out trying to find a job because this is just not cutting it.,,,
A,Yeah.,,,
A,Yeah,,,
B,"And so, I don't, I'm real glad that we didn't go see those funny ones when I was, when I'm still sort of on the sore side.",,,
A,Yeah,,,
B,"But,",,,
B,"well, what's your next,",,,
B,have you seen ROBIN HOOD yet?,,,
A,"No,",,,
A,"that was one, uh, Jay got to see with a friend",,,
A,and  so I,,,
B,Uh.,,,
A,"and to try and, uh, try and find time it's hard, uh, with Jim's schedule, too, just to get a time  that we can both go.",,,
B,Oh yeah.,,,
A,"And, uh, I'm holding out for CITY SLICKERS for the two of us because, uh, we had friends that went to see that and said, you know, it's just perfect for our age group",,,
B,Uh-huh.,,,
A,"and because I think he, he needs a comedy, too.",,,
A,"Uh, and that's what he would have liked to have seen REGARDING HENRY, too,",,,
A,"but knew that, uh,",,,
A,"we've, we've got a lot of company this summer, which is wonderful.",,,
A,We're really enjoying it,,,
A,"but some of the different things we're doing, uh  there's  just not a time, enough time to do it all",,,
B,Uh-huh.,,,
A,"and he said, well, realistically  You know, he  knew he couldn't get them all in.",,,
B,Yeah.,,,
A,"But, uh, Jay really liked ROBIN HOOD.",,,
A,"Um, when the choir group went to see BACKDRAFT and they thought that was, uh, it was funny cause he sounded like the critics.",,,
A,"He said, you know the plot line and the characters, uh, you know aren't real big",,,
A,"but the, the fire scenes and the  you know  that action part is fantastic.",,,
B,Uh-huh.,,,
A,"But, he thought ROBIN HOOD was great.",,,
A,"It was real different then you'd expect,",,,
A,but  but he enjoyed it,,,
B,Oh  really?,,,
A,"and  so,",,,
B,"Well I went,",,,
B,course I am a Kevin Costner fan.,,,
A,"Yeah,",,,
A,me too.,,,
A,"And  yeah,",,,
B,Supreme.,,,
A,"I really, uh, like him a lot. Which is why, DANCES WITH WOLVES was the last movie we had  seen   for several months",,,
B,Uh-huh.,,,
A,"but,",,,
B,"Gosh, was that wonderful.",,,
A,"It was,",,,
A,"I, uh,",,,
A,"in fact, uh, a friend from Germany was visiting in March",,,
A,"and we wanted, we didn't, ran out of time, we wanted to take him to see it.",,,
A,"We were going to sit through it again cause we really wanted him  to see it, too.",,,
B,"Oh, yeah.",,,
A,"Uh, I just thought that was terrific.",,,
A,"And I really enjoy Harrison Ford which is one of the reasons  I wanted to see,",,,
B,"I do, too.",,,
B,I think he's really good.,,,
A,And he's very good in REGARDING HENRY.,,,
A,"That's not an easy part to play, I, I don't think",,,
B,I wouldn't think.,,,
B,"Well, my kids are going to their Dad's tomorrow night",,,
B,so I sort of think I may go do that.,,,
A,Yeah.,,,
A,"That's at, that one won't your sides",,,
B,Good,,,
A,"Um, it,",,,
A,was this the first time you got to see ONE HUNDRED AND ONE DALMATIANS?,,,
A,"Or,",,,
B,I,,,
B,my parents took me when I was probably somewhere between Ashley and Jamie's age begin to,,,
A,Uh-huh.,,,
B,"And we went to the,",,,
